"Key","Item Type","Publication Year","Author","Title","Publication Title","ISBN","ISSN","DOI","Url","Abstract Note","Date","Date Added","Date Modified","Access Date","Pages","Num Pages","Issue","Volume","Number Of Volumes","Journal Abbreviation","Short Title","Series","Series Number","Series Text","Series Title","Publisher","Place","Language","Rights","Type","Archive","Archive Location","Library Catalog","Call Number","Extra","Notes","File Attachments","Link Attachments","Manual Tags","Automatic Tags","Editor","Series Editor","Translator","Contributor","Attorney Agent","Book Author","Cast Member","Commenter","Composer","Cosponsor","Counsel","Interviewer","Producer","Recipient","Reviewed Author","Scriptwriter","Words By","Guest","Number","Edition","Running Time","Scale","Medium","Artwork Size","Filing Date","Application Number","Assignee","Issuing Authority","Country","Meeting Name","Conference Name","Court","References","Reporter","Legal Status","Priority Numbers","Programming Language","Version","System","Code","Code Number","Section","Session","Committee","History","Legislative Body"
"6IX2T8YK","journalArticle","2021","Abreu AM; Young RR; Buchanan A; Lofgren IE; Okronipa HET; Lartey A; Ashorn P; Adu-Afarwuah S; Dewey KG; Oaks BM","Maternal Blood Pressure in Relation to Prenatal Lipid-Based Nutrient Supplementation and Adverse Birth Outcomes in a Ghanaian Cohort: A Randomized Controlled Trial and Cohort Analysis.","The Journal of nutrition","","0022-3166 (LINKING)","10.1093/jn/nxab018","","BACKGROUND: It is unknown whether prenatal lipid-based nutrient supplements (LNSs) affect blood pressure (BP). Associations between hypertension and birth outcomes using recently updated BP cutoffs are undetermined. OBJECTIVES: We aimed to assess the impact of LNSs on maternal hypertension and associations between hypertension and birth outcomes. METHODS: Pregnant Ghanaian women at </=20 weeks of gestation (n = 1320) were randomly assigned to receive daily 1) iron and folic acid (IFA), 2) multiple micronutrients (MMN), or 3) LNSs until delivery. BP was measured at enrollment and 36 weeks of gestation. We analyzed the effect of LNSs on BP using ANOVA and associations between hypertension [systolic BP (SBP) >/=130 mm Hg or diastolic BP (DBP) >/=80 mm Hg] and birth outcomes by linear and logistic regressions. RESULTS: Mean +/- SD SBP and DBP were 110 +/- 11 and 63 +/- 8 mm Hg at 36 weeks of gestation and did not differ by supplementation group (SBP, P > 0.05; DBP, P > 0.05). At enrollment, higher DBP was associated with lower birth weight and shorter gestation; women with high DBP had greater risk of low birth weight (LBW) [risk ratio (RR): 2.58; 95% CI: 1.09, 6.08] and preterm birth (PTB) (RR: 3.30; 95% CI: 1.47, 7.40). At 36 weeks of gestation, higher SBP was associated with lower birth weight, length, and head circumference and shorter gestation; higher DBP was associated with lower birth weight and length; and women with high DBP had greater risk of LBW (RR: 3.39; 95% CI: 1.32, 8.69). Neither high SBP nor hypertension were associated with birth outcomes at either time point. CONCLUSIONS: Daily provision of LNSs does not affect maternal hypertension, compared with IFA and MMN. Higher SBP and DBP are associated with a shorter gestation and smaller birth size; however, only high DBP is associated with LBW and PTB. The new BP cutoffs may help identify pregnancies at risk of adverse birth outcomes.This trial was registered at clinicaltrials.gov as NCT00970866.","2021-06","2024-02-20 10:59:45","2024-02-20 10:59:45","","1637-1645","","6","151","","","","","","","","","","","","","","","","","Number: 6 Place: United States","<div data-schema-version=""8""><p><strong>Location Information</strong></p> <p><strong>Location Name</strong> <strong>: </strong></p> <p>Names not specified</p> <p><strong>Location Type : </strong></p> <p>Health facility</p> <p><strong>Description : </strong></p> <p>Prenatal clinics in <span style=""color: rgb(31, 31, 31)"">Yilo and Manya Krobo districts of Ghana</span></p> <p><strong>Sample size :</strong> <span style=""color: rgb(31, 31, 31)"">&nbsp;</span></p> <p><span style=""color: rgb(31, 31, 31)"">1320</span></p> </div>","","","eppi-reviewer4; Female; Humans; Pregnancy; *birth outcomes; *Blood Pressure; *Dietary Supplements; *Ghana; *Hypertension/complications; *low birth weight; *maternal blood pressure; *maternal hypertension; *Maternal Nutritional Physiological Phenomena; *Pregnancy Complications; *Premature Birth; *prenatal supplements; *preterm birth; Birth Weight; Cohort Studies; Folic Acid; Ghana; Infant, Newborn; Iron; Lipids; Micronutrients; Vitamins","","","","","","","","","","","","","","","","","","","","","","","","","","","","","","","","","","","","","","","","","","","","","","",""
"2YBNVSST","journalArticle","2018","Bebell LM; Ngonzi J; Siedner MJ; Muyindike WR; Bwana BM; Riley LE; Boum Y 2nd; Bangsberg DR; Bassett IV","HIV Infection and risk of postpartum infection, complications and mortality in rural Uganda.","AIDS care","","0954-0121 (LINKING)","10.1080/09540121.2018.1434119","","HIV infection may increase risk of postpartum infection and infection-related mortality. We hypothesized that postpartum infection incidence and attributable mortality in Mbarara, Uganda would be higher in HIV-infected than HIV-uninfected women. We performed a prospective cohort study of 4231 women presenting to a regional referral hospital in 2015 for delivery or postpartum care. All febrile or hypothermic women, and a subset of randomly selected normothermic women were followed during hospitalization and with 6-week postpartum phone interviews. The primary outcome was in-hospital postpartum infection. Secondary outcomes included in-hospital complications (mortality, re-operation, intensive care unit transfer, need for imaging or blood transfusion) and 6-week mortality. We performed multivariable regression analyses to estimate adjusted differences in each outcome by HIV serostatus. Mean age was 25.2 years and 481 participants (11%) were HIV-infected. Median CD4+ count was 487 (IQR 325, 696) cells/mm(3), and 90% of HIV-infected women (193/215 selected for in-depth survey) were on antiretroviral therapy. Overall, 5% (205/4231) of women developed fever or hypothermia. Cumulative in-hospital postpartum infection incidence was 2.0% and did not differ by HIV status (aOR 1.4, 95% CI 0.6-3.3, P = 0.49). However, more HIV-infected women developed postpartum complications (4.4% vs. 1.2%, P = 0.001). In-hospital mortality was rare (2/1768, 0.1%), and remained so at 6 weeks (4/1526, 0.3%), without differences by HIV serostatus (P = 1.0 and 0.31, respectively). For women in rural Uganda with high rates of antiretroviral therapy coverage, HIV infection did not predict postpartum infection or mortality, but was associated with increased risk of postpartum complications.","2018-08","2024-02-20 10:59:45","2024-02-20 10:59:45","","943-953","","8","30","","","","","","","","","","","","","","","","","Number: 8 Place: England","<div data-schema-version=""8""><p><strong>Location Information</strong></p> <p><strong>Location Name : &nbsp;</strong>Mbarara Regional Referral Hospital (MRRH)</p> <p><strong>Location Type : </strong>Health facilities</p> <p><strong>Description : </strong>Mbarara Regional Referral Hospital (MRRH) in Mbarara, Uganda</p> <p><strong>Sample size : </strong>4,231</p> </div>","C:\Users\leon.mbano\Zotero\storage\QGC6VUXD\Bebell LM et al. - 2018 - HIV Infection and risk of postpartum infection, co.pdf","","*HIV; eppi-reviewer4; Adult; Female; Humans; Incidence; Pregnancy; *Africa; *antiretroviral; *infection; *Maternal Mortality; *Postpartum Period; *pregnancy; *puerperal sepsis; *Rural Population; CD4 Lymphocyte Count; HIV Infections/*complications/epidemiology/mortality; Hospitalization; Pregnancy Complications, Infectious/*epidemiology/mortality; Prospective Studies; Uganda/epidemiology; Young Adult","","","","","","","","","","","","","","","","","","","","","","","","","","","","","","","","","","","","","","","","","","","","","","",""
"5FEH96QR","journalArticle","2013","De Beaudrap P; Turyakira E; White LJ; Nabasumba C; Tumwebaze B; Muehlenbachs A; Guerin PJ; Boum Y; McGready R; Piola P","Impact of malaria during pregnancy on pregnancy outcomes in a Ugandan prospective cohort with intensive malaria screening and prompt treatment.","Malaria journal","","1475-2875 (LINKING)","10.1186/1475-2875-12-139","","BACKGROUND: Malaria in pregnancy (MiP) is a major public health problem in endemic areas of sub-Saharan Africa and has important consequences on birth outcome. Because MiP is a complex phenomenon and malaria epidemiology is rapidly changing, additional evidence is still required to understand how best to control malaria. This study followed a prospective cohort of pregnant women who had access to intensive malaria screening and prompt treatment to identify factors associated with increased risk of MiP and to analyse how various characteristics of MiP affect delivery outcomes. METHODS: Between October 2006 and May 2009, 1,218 pregnant women were enrolled in a prospective cohort. After an initial assessment, they were screened weekly for malaria. At delivery, blood smears were obtained from the mother, placenta, cord and newborn. Multivariate analyses were performed to analyse the association between mothers' characteristics and malaria risk, as well as between MiP and birth outcome, length and weight at birth. This study is a secondary analysis of a trial registered with ClinicalTrials.gov, number NCT00495508. RESULTS: Overall, 288/1,069 (27%) mothers had 345 peripheral malaria infections. The risk of peripheral malaria was higher in mothers who were younger, infected with HIV, had less education, lived in rural areas or reported no bed net use, whereas the risk of placental infection was associated with more frequent malaria infections and with infection during late pregnancy. The risk of pre-term delivery and of miscarriage was increased in mothers infected with HIV, living in rural areas and with MiP occurring within two weeks of delivery.In adjusted analysis, birth weight but not length was reduced in babies of mothers exposed to MiP (-60 g, 95%CI: -120 to 0 for at least one infection and -150 g, 95%CI: -280 to -20 for >1 infections). CONCLUSIONS: In this study, the timing, parasitaemia level and number of peripherally-detected malaria infections, but not the presence of fever, were associated with adverse birth outcomes. Hence, prompt malaria detection and treatment should be offered to pregnant women regardless of symptoms or other preventive measures used during pregnancy, and with increased focus on mothers living in remote areas.","2013-04","2024-02-20 10:59:45","2024-02-20 10:59:45","","139","","","12","","","","","","","","","","","","","","","","","Place: England","<div data-schema-version=""8""><p><strong>Location Information</strong></p> <p><strong>Location Name : &nbsp;</strong></p> <p>Names not specified</p> <p><strong>Location Type : </strong></p> <p>Health facilities</p> <p><strong>Description : </strong><span style=""color: rgb(51, 51, 51)""><span style=""background-color: rgb(255, 255, 255)"">&nbsp; </span></span></p> <p><span style=""color: rgb(51, 51, 51)""><span style=""background-color: rgb(255, 255, 255)"">Facilities in Mbarara district, southwestern Uganda</span></span></p> <p><strong>Sample size : </strong></p> <p><span style=""color: rgb(51, 51, 51)""><span style=""background-color: rgb(255, 255, 255)"">1,218&nbsp;</span></span></p> </div>","","","eppi-reviewer4; Adult; Female; Humans; Pregnancy; Cohort Studies; Infant, Newborn; Prospective Studies; Uganda/epidemiology; Young Adult; *Pregnancy Outcome; Blood/parasitology; Malaria/*diagnosis/drug therapy/*epidemiology/parasitology; Male; Parasite Load; Pregnancy Complications, Infectious/*diagnosis/drug therapy/*epidemiology; Premature Birth/*epidemiology; Risk Factors","","","","","","","","","","","","","","","","","","","","","","","","","","","","","","","","","","","","","","","","","","","","","","",""
"7Z9I44EZ","journalArticle","2022","Adeoye IA; Sogbesan A; Esan O","Prevalence, associated factors and perinatal outcomes of antepartum depression in Ibadan Nigeria.","BMC pregnancy and childbirth","","1471-2393 (LINKING)","10.1186/s12884-022-04549-7","","BACKGROUND: Antepartum depression is the most common mental health disorder in pregnancy and it is also a risk factor for adverse perinatal outcomes. Low and middle income countries like Nigeria bear a higher burden of antepartum depression compared with high income countries. Prioritizing mental health issues among pregnant women is crucial to achieving the Sustainable Development Goals. We determined the prevalence, associated factors and perinatal outcomes of antepartum depression among pregnant women in Ibadan, Nigeria. METHODS: A prospective cohort study was conducted among 1745 pregnant women enrolled early in pregnancy (</= 20 weeks) at four comprehensive obstetric facilities within Ibadan metropolis. Antepartum depression was ascertained during the third trimester using the Edinburg Postpartum Depression Scale >/= 12. The primary exposure was antepartum depression and the outcome variables were the perinatal outcomes. The associated factors assessed included sociodemographic, obstetric, psychological, and lifestyle characteristics. Bi-variate logistic and Poisson regression analyses were used to assess the factors and relative risk for perinatal outcomes of antepartum depression. RESULTS: The prevalence of antepartum depression was 14.1%. The significant factors associated with APD after adjusting for confounders were: high income (>/= 20, 000) which was protective (AOR) = 0.59; 95% CI: (0.40 - 0.88); p-value: 0.010] and perceived stress increased the odds of APD in a monotonic fashion: moderate stress [AOR = 2.39; 95% CI: (1.01 - 5.7); p-value: 0.047], high stress [AOR = 6.43; 95% CI: (2.28 - 18.2); p-value: < 0.001]. Preterm delivery was the only significant perinatal outcome [Relative Risk (RR) = 1.66; 95% CI (1.14 - 2.39); p-value = 0.007]. Depression did not increase the risk of having low birth weight babies (p = 0.513), macrosomia (p = 0.894), birth asphyxia (p = 0.317), and caesarean section (p = 0.298). CONCLUSIONS: APD was prevalent among our study population. The significant factors identified in this study can be targeted to reduce the occurrence of APD among pregnant women in Nigeria through appropriate social and public health interventions which include APD screening, counselling, and the provision of emotional support for pregnant women during antenatal care.","2022-03","2024-02-20 10:59:45","2024-02-20 10:59:45","","219","","1","22","","","","","","","","","","","","","","","","","Number: 1 Place: England","<div data-schema-version=""8""><p><strong>Location Information</strong></p> <p><strong>Location Name :</strong></p> <p><span style=""color: rgb(28, 43, 51)""><span style=""background-color: rgb(255, 255, 255)"">University College Hospital, Adeoyo Maternity Teaching Hospital, Jericho Specialist Hospital, Saint Mary Catholic Hospital</span></span></p> <p><strong>Location Type :</strong></p> <p>Health facilities</p> <p><strong>Description :</strong></p> <p><span style=""color: rgb(51, 51, 51)""><span style=""background-color: rgb(255, 255, 255)"">Conducted in four hospitals in Ibadan, the capital city of Oyo State, southwest, Nigeria.</span></span></p> <p><strong>Sample size :</strong></p> <p><span style=""color: rgb(51, 51, 51)""><span style=""background-color: rgb(255, 255, 255)"">1745</span></span></p> </div>","","","eppi-reviewer4; Adult; Female; Humans; Pregnancy; Cohort Studies; Infant, Newborn; Prospective Studies; Nigeria; Risk Factors; Antepartum depression; Birth outcomes; Depression/*psychology; Maternal health; Mental health; Nigeria/epidemiology; Pregnancy Complications/*psychology; Pregnancy Outcome/epidemiology; Prevalence","","","","","","","","","","","","","","","","","","","","","","","","","","","","","","","","","","","","","","","","","","","","","","",""
"82L92XN8","journalArticle","2017","Antwi E; Groenwold RH; Browne JL; Franx A; Agyepong IA; Koram KA; Klipstein-Grobusch K; Grobbee DE","Development and validation of a prediction model for gestational hypertension in a Ghanaian cohort.","BMJ open","","2044-6055 (LINKING)","10.1136/bmjopen-2016-012670","","OBJECTIVE: To develop and validate a prediction model for identifying women at increased risk of developing gestational hypertension (GH) in Ghana. DESIGN: A prospective study. We used frequencies for descriptive analysis, chi(2) test for associations and logistic regression to derive the prediction model. Discrimination was estimated by the c-statistic. Calibration was assessed by calibration plot of actual versus predicted probability. SETTING: Primary care antenatal clinics in Ghana. PARTICIPANTS: 2529 pregnant women in the development cohort and 647 pregnant women in the validation cohort. Inclusion criterion was women without chronic hypertension. PRIMARY OUTCOME: Gestational hypertension. RESULTS: Predictors of GH were diastolic blood pressure, family history of hypertension in parents, history of GH in a previous pregnancy, parity, height and weight. The c-statistic of the original model was 0.70 (95% CI 0.67-0.74) and 0.68 (0.60 to 0.77) in the validation cohort. Calibration was good in both cohorts. The negative predictive value of women in the development cohort at high risk of GH was 92.0% compared to 94.0% in the validation cohort. CONCLUSIONS: The prediction model showed adequate performance after validation in an independent cohort and can be used to classify women into high, moderate or low risk of developing GH. It contributes to efforts to provide clinical decision-making support to improve maternal health and birth outcomes.","2017-01","2024-02-20 10:59:45","2024-02-20 10:59:45","","e012670","","1","7","","","","","","","","","","","","","","","","","Number: 1 Place: England","<div data-schema-version=""8""><p><strong>Location Information</strong></p> <p><strong>Location Name</strong> <strong>:</strong></p> <p>Names not specified </p> <p><strong>Location Type</strong> <strong>:</strong></p> <p>Health facilities</p> <p><strong>Description</strong> <strong>:</strong> &nbsp;</p> <p><span style=""color: rgb(51, 51, 51)""><span style=""background-color: rgb(255, 255, 255)"">Six Primary care antenatal clinics &nbsp;in the Greater Accra region of Ghana</span></span></p> <p><strong>Sample size</strong> <strong>:</strong></p> <p><span style=""color: rgb(51, 51, 51)""><span style=""background-color: rgb(255, 255, 255)"">2529</span></span></p> </div>","","","eppi-reviewer4; Adult; Female; Humans; Pregnancy; Cohort Studies; Ghana; Prospective Studies; Risk Factors; *gestational hypertension; *hypertensive disorders of pregnancy; *prediction model; *predictors; *risk scores; Clinical Decision-Making/*methods; Hypertension, Pregnancy-Induced/*diagnosis; Reproducibility of Results; Risk Assessment; ROC Curve","","","","","","","","","","","","","","","","","","","","","","","","","","","","","","","","","","","","","","","","","","","","","","",""
"CMQCTZUB","journalArticle","2013","Bindt C; Guo N; Bonle MT; Appiah-Poku J; Hinz R; Barthel D; Schoppen S; Feldt T; Barkmann C; Koffi M; Loag W; Nguah SB; Eberhardt KA; Tagbor H; N'goran E; Ehrhardt S","No association between antenatal common mental disorders in low-obstetric risk women and adverse birth outcomes in their offspring: results from the CDS study in Ghana and Cote D'Ivoire.","PloS one","","1932-6203 (LINKING)","10.1371/journal.pone.0080711","","BACKGROUND: Evidence linking common mental disorders (CMD) in pregnant women to adverse birth outcomes is inconsistent, and studies often failed to control for pregnancy complications. This study aimed to explore the association between antenatal depression and anxiety symptoms and birth outcomes in a low-obstetric risk sample of mother/child dyads in Ghana and Cote d'Ivoire. METHODS: In 2010-2011, a prospective cohort of 1030 women in their third trimester in Ghana and Cote d'Ivoire was enrolled. Depression and anxiety were assessed in the third trimester using the Patient Health Questionnaire depression module and the 7-item Generalized Anxiety Disorder scale. 719 mother/child dyads were included in the analysis. We constructed multivariate regression models to estimate the association between CMD and low birth weight (LBW), and preterm birth (PTB) to control for potential confounders. RESULTS: The prevalence of depression and anxiety symptoms were 28.9% and 14.2% respectively. The mean birth weight was 3172.1g (SD 440.6) and the prevalence of LBW was 1.7%. The mean gestational age was 39.6 weeks and the proportion of PTB was 4%. Multivariate linear regression revealed no significant association between maternal depression (B=52.2, 95% CI -18.2 122.6, p=0.15) or anxiety (B=17.1, 95% CI -74.6 108.7, p=0.72) and birth weight. Yet, low socio-economic status, female sex of the child, and younger maternal age were associated with lower birth weight. Multivariate logistic regression suggested no significant association between maternal depression (OR: 2.1, 95% CI 0.8 5.6, p=0.15) or anxiety (OR: 1.8, 95% CI 0.6 5.5, p=0.29) with PTB. CONCLUSIONS: Our data suggests that depression and/or anxiety in the 3(rd) trimester of pregnancy are not independent predictors of adverse birth outcomes in low obstetric risk women. The role of pregnancy complications as confounders or effect modifiers in studies of maternal CMD and their impact on birth outcomes should be investigated.","2013","2024-02-20 10:59:45","2024-02-20 10:59:45","","e80711","","11","8","","","","","","","","","","","","","","","","","Number: 11 Place: United States","<div data-schema-version=""8""><p><strong>Location Information</strong></p> <p><strong>Location Name :</strong></p> <p><span style=""color: rgb(32, 32, 32)""><span style=""background-color: rgb(255, 255, 255)"">Komfo Anokye Hospital , Abobo Hospital </span></span></p> <p><strong>Location Type :</strong></p> <p>Health facilities</p> <p><strong>Description : </strong><span style=""color: rgb(32, 32, 32)""><span style=""background-color: rgb(255, 255, 255)"">&nbsp;</span></span></p> <p><span style=""color: rgb(32, 32, 32)""><span style=""background-color: rgb(255, 255, 255)"">Hospitals, the Komfo Anokye Teaching Hospital in Kumasi, Ghana, and the Abobo Community Hospital in Abidjan, CôteGhana and Côte d’Ivoire</span></span></p> <p><strong>sample size :</strong> &nbsp;</p> <p><span style=""color: rgb(32, 32, 32)""><span style=""background-color: rgb(255, 255, 255)"">1030&nbsp;</span></span></p> </div>","","","eppi-reviewer4; Adult; Female; Humans; Pregnancy; *Pregnancy Complications; Prospective Studies; Young Adult; Risk Factors; Prevalence; Anxiety/epidemiology; Cote d'Ivoire/epidemiology; Depression/epidemiology; Ghana/epidemiology; Longitudinal Studies; Mental Disorders/*epidemiology; Pregnancy Outcome/*epidemiology; Pregnancy Trimester, Third","","","","","","","","","","","","","","","","","","","","","","","","","","","","","","","","","","","","","","","","","","","","","","",""
