"T5EG8HJK","journalArticle","2016","Moodley J; Onyangunga OA; Maharaj NR","Hypertensive disorders in primigravid black South African women: A one-year descriptive analysis.","Hypertension in pregnancy","","1064-1955 (Linking)","10.1080/10641955.2016.1193190","","OBJECTIVE: To describe the incidence and obstetric and perinatal outcomes in primigravid Black South Africans with hypertensive disorders of pregnancy (HDP). METHOD: All primigravidae who booked for antenatal care were followed up until hospital discharge. Relevant clinical and demographic data were collected in structured data forms. RESULTS: A total of 5860 primigravidae delivered during the study period. Of these, 731 had an HDP, giving an incidence of 12.5%. The diagnosis of gestational hypertension was made in 6.7% of all primigravidae but was the commonest HDP subcategory (n = 394/731; 53.9%). On the other hand, mild to moderate preeclampsia or non-severe preeclampsia, severe preeclampsia, and eclampsia occurred in 222, 84, and 31 of the 5860 primigravidae, respectively. Therefore, preeclampsia-eclampsia syndrome occurred in 337/5860 or 5.75% of the study population. Severe preeclampsia occurred in 1.43% (84/5860) of the primigravidae. The rates of caesarean deliveries in women with preeclampsia were approximately 50%. There were no perinatal deaths in the gestational hypertension group, but the overall perinatal mortality rate in all preeclamptics was 5.9%, in comparison to 2.2% in all primigravidae. CONCLUSION: Hypertensive disorders of pregnancy developed in 12.5% (n = 731/5860) of primigravidae seen over a one-year period. Gestational hypertension comprised the commonest subcategory of the HDP and there were no perinatal deaths in this group.","2016-11","2024-01-16 12:27:56","2024-01-16 12:27:56","","529-535","","4","35","","","","","","","","","","","","","","","","","Place: England","<div data-schema-version=""8""><p><strong>Location Information</strong></p> <p><strong>Location Name</strong> <strong>:</strong></p> <p>Name not specified</p> <p><strong>Location Type :</strong></p> <p>Health facilities</p> <p><strong>Description :</strong> &nbsp;</p> <p><span style=""color: rgb(13, 13, 13)""><span style=""background-color: rgb(255, 255, 255)"">Conducted in South Africa, specifically among primigravid Black South Africans.</span></span></p> <p><strong>Sample size :</strong></p> <p>731</p> <p></p> <p></p> <p></p> <p></p> <p></p> <p></p> </div>","","","eppi-reviewer4; Adult; Female; Humans; Incidence; Pregnancy; Young Adult; Prevalence; Pregnancy Outcome; South Africa/epidemiology; *Parity; Hypertensive disorders of pregnancy; *African Continental Ancestry Group; Hypertension, Pregnancy-Induced/epidemiology/*ethnology; obstetric outcomes; primigravidae","","","","","","","","","","","","","","","","","","","","","","","","","","","","","","","","","","","","","","","","","","","","","","",""
"MZKJNYKH","journalArticle","2021","Mitku AA; Zewotir T; North D; Jeena P; Naidoo RN","Effects of prenatal exposure factors on birth outcomes through mediation of favorable fetal growth conditions using structural equation modeling.","PloS one","","1932-6203 (Linking)","10.1371/journal.pone.0249664","","BACKGROUND: Birth weight, birth length, and gestational age are major indicators of newborn health. Several prenatal exposure factors influence the fetal environment. The aim of the study was to investigate the effect of prenatal exposure factors, including socio-demographic, behavioural, dietary, physical activity, clinical and environmental on birth outcomes through the mediation of Favourable Fetal Growth Conditions (FFGC). METHODS: Data was obtained from six hundred and fifty-six Mother and Child in the Environment birth cohort study in Durban, South Africa from 2013 to 2017. We adopted structural equation models which evaluate the direct and indirect effects by allowing multiple simultaneous equations to incorporate confounding and mediation. RESULTS: A significant direct and indirect effect of FFGC on newborn weight, length, and gestational age was seen. Gestational weight gain and maternal body mass index in the first trimester exerted a mediation effect between maternal behavioural risk factors and FFGC. Similarly, the level of physical activity during pregnancy was associated with decreased gestational weight gain. The effects of maternal characteristics on newborn weight, length, and gestational age were largely indirect, operating through FFGC as a latent variable. CONCLUSIONS: Gestational weight gain and maternal pre-gestational BMI were observed to mediate the association between prenatal behavioural risk factors and favourable fetal growth conditions. TRIAL REGISTRATION: Retrospectively registered from 01 March 2013.","2021","2024-01-16 12:27:56","2024-01-16 12:27:56","","e0249664","","4","16","","","","","","","","","","","","","","","","","Place: United States","<div data-schema-version=""8""><p><strong>Location Information</strong></p> <p><strong>Location Name</strong> <strong>:</strong></p> <p>Names not specified</p> <p><strong><span style=""color: var(--tw-prose-bold)"">Location Type :</span></strong></p> <p>Health facilities</p> <p><strong><span style=""color: var(--tw-prose-bold)"">Description :</span></strong></p> <p><span style=""color: rgb(13, 13, 13)""><span style=""background-color: rgb(255, 255, 255)"">conducted in public sector antenatal clinics in the study areas in Durban, South Africa,</span></span></p> <p><strong><span style=""color: var(--tw-prose-bold)"">Sample size :</span></strong></p> <p><span style=""color: rgb(13, 13, 13)""><span style=""background-color: rgb(255, 255, 255)"">The study initially enrolled </span></span><strong><span style=""color: rgb(13, 13, 13)""><span style=""background-color: rgb(255, 255, 255)"">996</span></span></strong><span style=""color: rgb(13, 13, 13)""><span style=""background-color: rgb(255, 255, 255)""> pregnant women, with </span></span><strong><span style=""color: rgb(13, 13, 13)""><span style=""background-color: rgb(255, 255, 255)"">656 mother-child pairs </span></span></strong><span style=""color: rgb(13, 13, 13)""><span style=""background-color: rgb(255, 255, 255)"">remaining after exclusions and follow-up.</span></span></p> </div>","","","eppi-reviewer4; Adult; Female; Humans; Pregnancy; Cohort Studies; Infant, Newborn; Male; Gestational Age; South Africa/epidemiology; Body Mass Index; Birth Weight/*drug effects; Body Size/drug effects; Fetal Development/drug effects/physiology; Gestational Weight Gain; Latent Class Analysis; Maternal Exposure/*adverse effects; Models, Statistical; Prenatal Exposure Delayed Effects/*epidemiology","","","","","","","","","","","","","","","","","","","","","","","","","","","","","","","","","","","","","","","","","","","","","","",""
"WJB5H4TB","journalArticle","2021","Milln J; Nakabuye B; Natamba BK; Sekitoleko I; Mubiru M; Namara AA; Tumwesigire S; Tino S; Mirembe M; Kakande A; Agaba B; Nansubuga F; Zaake D; Ayiko B; Kalema H; Nakubulwa S; Sekikubo M; Nakimuli A; Webb EL; Nyirenda MJ","Antenatal management and maternal/fetal outcomes associated with hyperglycaemia in pregnancy (HIP) in Uganda; a prospective cohort study.","BMC pregnancy and childbirth","","1471-2393 (Linking)","10.1186/s12884-021-03795-5","","BACKGROUND: Hyperglycaemia in pregnancy (HIP) is associated with complications for both mother and baby. The prevalence of the condition is likely to increase across Africa as the continent undergoes a rapid demographic transition. However, little is known about the management and pregnancy outcomes associated with HIP in the region, particularly less severe forms of hyperglycaemia. It is therefore important to generate local data so that resources may be distributed effectively. The aim of this study was to describe the antenatal management and maternal/fetal outcomes associated with HIP in Ugandan women. METHODS: A prospective cohort study of 2917 pregnant women in five major hospitals in urban/semi-urban central Uganda. Women were screened with oral glucose tolerance test (OGTT) at 24-28 weeks of gestation. Cases of gestational diabetes (GDM) and diabetes in pregnancy (DIP) were identified (WHO 2013 diagnostic criteria) and received standard care. Data was collected on maternal demographics, anthropometrics, antenatal management, umbilical cord c-peptide levels, and pregnancy outcomes. RESULTS: Two hundred and seventy-six women were diagnosed with HIP (237 classified as GDM and 39 DIP). Women had between one and four fasting capillary blood glucose checks during third trimester. All received lifestyle advice, one quarter (69/276) received metformin therapy, and one woman received insulin. HIP was associated with large birthweight (unadjusted relative risk 1.30, 95% CI 1.00-1.68), Caesarean delivery (RR 1.34, 95% CI 1.14-1.57) and neonatal hypoglycaemia (RR 4.37, 95% CI 1.36-14.1), but not perinatal mortality or preterm birth. Pregnancy outcomes were generally worse for women with DIP compared with GDM. CONCLUSION: HIP is associated with significant adverse pregnancy outcomes in this population, particularly overt diabetes in pregnancy. However pregnancy outcomes in women with milder forms of hyperglycaemia are similar to those with normoglycaemic pregnancies. Intervention strategies are required to improve current monitoring and management practice, and more research needed to understand if this is a cost-effective way of preventing poor perinatal outcomes.","2021-05","2024-01-16 12:27:56","2024-01-16 12:27:56","","386","","1","21","","","","","","","","","","","","","","","","","Place: England","<div data-schema-version=""8""><p><strong>Location Information</strong></p> <p><strong><span style=""color: black""><span style=""background-color: white"">Location Name : &nbsp;</span></span></strong></p> <p>Names not specified</p> <p><strong><span style=""color: black""><span style=""background-color: white"">Location Type :</span></span></strong></p> <p>Health facilities</p> <p><strong><span style=""color: black""><span style=""background-color: white"">Description :</span></span></strong></p> <p><span style=""color: rgb(13, 13, 13)""><span style=""background-color: rgb(255, 255, 255)"">Conducted in five major hospitals in urban and peri-urban areas of central Uganda</span></span></p> <ul> <li> <span style=""color: rgb(13, 13, 13)""><span style=""background-color: rgb(255, 255, 255)"">Three public facilities managed by the Uganda Ministry of Health</span></span> </li> <li> <span style=""color: rgb(13, 13, 13)""><span style=""background-color: rgb(255, 255, 255)"">Two private-not-for-profit hospitals managed by the Uganda Catholic Medical Services Bureau</span></span> </li> </ul> <p><strong>Sample Size :</strong> &nbsp;</p> <p>3852</p> </div>","","","eppi-reviewer4; Adult; Female; Humans; Pregnancy; Cohort Studies; Infant, Newborn; Prospective Studies; Uganda/epidemiology; Young Adult; Male; Pregnancy Outcome/*epidemiology; Diabetes; Diabetes, Gestational/blood/*epidemiology; Gestational; Hospitals; Hyperglycemia/blood/*epidemiology; Macrosomia; Sub Saharan-Africa","","","","","","","","","","","","","","","","","","","","","","","","","","","","","","","","","","","","","","","","","","","","","","",""
"V7YSMUGQ","journalArticle","2022","Miller AP; Shoptaw S; Mvududu R; Mashele N; Coates TJ; Bekker LG; Essack Z; Groenewald C; Petersen Z; Gorbach PM; Myer L; Joseph Davey DL","Sexual Risk among Pregnant Women at Risk of HIV Infection in Cape Town, South Africa: What Does Alcohol Have to Do with It?","AIDS and behavior","","1090-7165 (Linking)","10.1007/s10461-022-03742-1","","This study examines baseline associations between alcohol use and HIV sexual risk among a cohort of HIV-uninfected pregnant women (n = 1201) residing in a high HIV burdened community in Cape Town, South Africa. Alcohol use was measured using a modified version of the Alcohol Use Disorder Identification Test (AUDIT). HIV sexual risk was measured through a composite variable of four risk factors: diagnosis with a STI, self-report of > 1 recent sex partners, partner HIV serostatus (unknown or HIV+) and condomless sex at last sex. Any past year alcohol use prior to pregnancy was reported by half of participants (50%); 6.0% reported alcohol use during pregnancy. Alcohol use prior to pregnancy was associated with increased odds of being at high risk of HIV (aOR = 1.33, 95% CI 1.05-1.68, for 2 risks and aOR = 1.47, 95% CI 0.95-2.27 for 3 risks). In addition to reducing alcohol use, several other strategies to address HIV sexual risk were identified. Evidence-based interventions to address alcohol use and other HIV sexual risk behaviors during pregnancy in South Africa are desperately needed. Qualitative work exploring individual and community level drivers of alcohol use among pregnant and breastfeeding women in this setting could support development of a culturally tailored intervention to address these issues in this population.","2022-06","2024-01-16 12:27:56","2024-01-16 12:27:56","","","","","","","","","","","","","","","","","","","","","","Place: United States","<div data-schema-version=""8""><p><strong>Location Information</strong></p> <p><strong><span style=""color: black""><span style=""background-color: white"">Location Name : &nbsp;</span></span></strong></p> <p><span style=""color: black""><span style=""background-color: white"">Name not specified</span></span></p> <p><strong><span style=""color: black""><span style=""background-color: white"">Location Type :</span></span></strong></p> <p><span style=""color: black""><span style=""background-color: white"">health facilities</span></span></p> <p><strong><span style=""color: black""><span style=""background-color: white"">Description :</span></span></strong></p> <p><span style=""color: #0D0D0D""><span style=""background-color: white"">Conducted at one public health clinic in Gugulethu,Cape Town, Western Cape, South Africa.</span></span></p> <p><strong>Sample Size :</strong></p> <p>&nbsp;1201</p> </div>","","","eppi-reviewer4; Pregnancy; South Africa; HIV; Sub-Saharan Africa; Alcohol use","","","","","","","","","","","","","","","","","","","","","","","","","","","","","","","","","","","","","","","","","","","","","","",""
"R5ND3ESY","journalArticle","2022","Medina-Marino A; Cleary S; Muzny CA; Taylor C; Tamhane A; Ngwepe P; Bezuidenhout C; Facente SN; Mlisana K; Peters RPH; Klausner JD","Sexually transmitted infection screening to prevent adverse birth and newborn outcomes: study protocol for a randomized-controlled hybrid-effectiveness trial.","Trials","","1745-6215 (Linking)","10.1186/s13063-022-06400-y","","BACKGROUND: Sexually transmitted infections (STIs) during pregnancy are associated with adverse birth outcomes, including preterm birth, low birth weight, perinatal death, and congenital infections such as increased mother-to-child HIV transmission. Prevalence of STIs among pregnant women in South Africa remains high, with most women being asymptomatic for their infection(s). Unfortunately, most STIs remain undetected and untreated due to standard practice syndromic management in accordance with World Health Organization (WHO) guidelines. Although lab-based and point-of-care molecular tests are available, optimal screening strategies during pregnancy, their health impact, and cost-effectiveness are unknown. METHODS: We will implement a 3-arm (1:1:1) type-1 hybrid effectiveness-implementation randomized-controlled trial (RCT). We will enroll 2500 pregnant women attending their first antenatal care (ANC) visit for their current pregnancy at participating health facilities in Buffalo City Metro District, Eastern Cape Province, South Africa. Participants allocated to arms 1 and 2 (intervention) will receive GeneXpert(R) point-of-care diagnostic testing for Neisseria gonorrhoeae, Chlamydia trachomatis, and Trichomonas vaginalis, with same-day treatment for detected infection(s). Arm 1 will additionally receive a test-of-cure 3 weeks post-treatment, while Arm 2 will receive a repeat test at 30-34 weeks' gestation. Those allocated to Arm 3 will receive syndromic management (standard-of-care). The RE-AIM framework will be used to guide collection of implementation indicators to inform potential future scale up. Primary outcome measures include (1) frequency of adverse birth outcomes among study arms, defined by a composite measure of low birth weight and pre-term delivery, and (2) change in STI prevalence between baseline and birth outcome among intervention arms and compared to standard-of-care. Estimates and comparative costs of the different screening strategies relative to standard-of-care and the costs of managing adverse birth outcomes will be calculated. Cost-effectiveness will be assessed per STI and disability-adjusted life year averted. DISCUSSION: This trial is the first RCT designed to identify optimal, cost-effective screening strategies that decrease the burden of STIs during pregnancy and reduce adverse birth outcomes. Demonstrating the impact of diagnostic screening and treatment, compared to syndromic management, on birth outcomes will provide critical evidence to inform changes to WHO guidelines for syndromic management of STIs during pregnancy. TRIAL REGISTRATION: ClinicalTrials.gov NCT04446611 . Registered on 25 June 2020.","2022-05","2024-01-16 12:27:56","2024-01-16 12:27:56","","441","","1","23","","","","","","","","","","","","","","","","","Place: England","<div data-schema-version=""8""><p><strong>Location Information</strong></p> <p><strong>Location Name</strong> <strong>:</strong></p> <p>Names not specified</p> <p><strong>Location Type</strong> <strong>:</strong></p> <p>Health facilities</p> <p><strong>Description</strong> <strong>:</strong></p> <p><span style=""color: rgb(13, 13, 13)""><span style=""background-color: rgb(255, 255, 255)"">Conducted in three ANC clinics in Buffalo City Metro Health District, Eastern Cape Province, South Africa</span></span></p> <p><strong>Sample size</strong> <strong>:</strong></p> <p>2500</p> </div>","","","eppi-reviewer4; Female; Humans; Pregnancy; Prevalence; Randomized Controlled Trials as Topic; Antenatal care; Preterm birth; Low birth weight; *Pregnancy Complications, Infectious/diagnosis/epidemiology/prevention & control; *Sexually Transmitted Diseases/diagnosis/epidemiology/prevention & control; *Trichomonas vaginalis; Chlamydia trachomatis; Cost-effectiveness; Neisseria gonorrhoeae; Sexually transmitted infections; STI screening; STIs; Syndromic management","","","","","","","","","","","","","","","","","","","","","","","","","","","","","","","","","","","","","","","","","","","","","","",""
"FSNECYXZ","journalArticle","2014","McClure EM; Nathan RO; Saleem S; Esamai F; Garces A; Chomba E; Tshefu A; Swanson D; Mabeya H; Figuero L; Mirza W; Muyodi D; Franklin H; Lokangaka A; Bidashimwa D; Pasha O; Mwenechanya M; Bose CL; Carlo WA; Hambidge KM; Liechty EA; Krebs N; Wallace DD; Swanson J; Koso-Thomas M; Widmer R; Goldenberg RL","First look: a cluster-randomized trial of ultrasound to improve pregnancy outcomes in low income country settings.","BMC pregnancy and childbirth","","1471-2393 (Linking)","10.1186/1471-2393-14-73","","BACKGROUND: In high-resource settings, obstetric ultrasound is a standard component of prenatal care used to identify pregnancy complications and to establish an accurate gestational age in order to improve obstetric care. Whether or not ultrasound use will improve care and ultimately pregnancy outcomes in low-resource settings is unknown. METHODS/DESIGN: This multi-country cluster randomized trial will assess the impact of antenatal ultrasound screening performed by health care staff on a composite outcome consisting of maternal mortality and maternal near-miss, stillbirth and neonatal mortality in low-resource community settings. The trial will utilize an existing research infrastructure, the Global Network for Women's and Children's Health Research with sites in Pakistan, Kenya, Zambia, Democratic Republic of Congo and Guatemala. A maternal and newborn health registry in defined geographic areas which documents all pregnancies and their outcomes to 6 weeks post-delivery will provide population-based rates of maternal mortality and morbidity, stillbirth, neonatal mortality and morbidity, and health care utilization for study clusters. A total of 58 study clusters each with a health center and about 500 births per year will be randomized (29 intervention and 29 control). The intervention includes training of health workers (e.g., nurses, midwives, clinical officers) to perform ultrasound examinations during antenatal care, generally at 18-22 and at 32-36 weeks for each subject. Women who are identified as having a complication of pregnancy will be referred to a hospital for appropriate care. Finally, the intervention includes community sensitization activities to inform women and their families of the availability of ultrasound at the antenatal care clinic and training in emergency obstetric and neonatal care at referral facilities. DISCUSSION: In summary, our trial will evaluate whether introduction of ultrasound during antenatal care improves pregnancy outcomes in rural, low-resource settings. The intervention includes training for ultrasound-naive providers in basic obstetric ultrasonography and then enabling these trainees to use ultrasound to screen for pregnancy complications in primary antenatal care clinics and to refer appropriately. TRIAL REGISTRATION: Clinicaltrials.gov (NCT # 01990625).","2014-02","2024-01-16 12:27:56","2024-01-16 12:27:56","","73","","","14","","","","","","","","","","","","","","","","","Place: England","<div data-schema-version=""8""><p><strong>Location Information</strong></p> <p><strong>Location &nbsp;Name</strong> <strong>:</strong></p> <p>Names not specified</p> <p><strong>Location type</strong> <strong>:</strong></p> <p>Health facilities and communities</p> <p><strong>Description</strong> <strong>:</strong></p> <p><span style=""color: rgb(51, 51, 51)""><span style=""background-color: rgb(255, 255, 255)"">58 study clusters each with a health center sites in Pakistan, Kenya, Zambia, Democratic Republic of Congo and Guatemala,</span></span></p> <p><strong>Sample size :</strong></p> <p>23365</p> </div>","","","eppi-reviewer4; Adult; Female; Humans; Pregnancy; Infant, Newborn; *Pregnancy Outcome; *Developing Countries; Gestational Age; Socioeconomic Factors; Zambia/epidemiology; Rural Population; Cluster Analysis; Kenya/epidemiology; Prenatal Care/*methods; Pakistan/epidemiology; Maternal Mortality/trends; Guatemala/epidemiology; Ultrasonography, Prenatal/*standards; *Maternal Welfare; Congo/epidemiology; Infant Mortality/trends; Maternal Health Services/*standards; Midwifery/standards; Morbidity/trends; Pregnancy Complications/*diagnostic imaging/epidemiology","","","","","","","","","","","","","","","","","","","","","","","","","","","","","","","","","","","","","","","","","","","","","","",""
