"KYMI2XIS","journalArticle","2015","Desai M; Gutman J; L'lanziva A; Otieno K; Juma E; Kariuki S; Ouma P; Were V; Laserson K; Katana A; Williamson J; ter Kuile FO","Intermittent screening and treatment or intermittent preventive treatment with dihydroartemisinin-piperaquine versus intermittent preventive treatment with sulfadoxine-pyrimethamine for the control of malaria during pregnancy in western Kenya: an open-label, three-group, randomised controlled superiority trial.","Lancet (London, England)","","0140-6736 (Linking)","10.1016/S0140-6736(15)00310-4","","BACKGROUND: Every year, more than 32 million pregnancies in sub-Saharan Africa are at risk of malaria infection and its adverse consequences. The effectiveness of the intermittent preventive treatment with sulfadoxine-pyrimethamine strategy recommended by WHO is threatened by high levels of parasite resistance. We aimed to assess the efficacy and safety of two alternative strategies: intermittent screening with malaria rapid diagnostic tests and treatment of women who test positive with dihydroartemisinin-piperaquine, and intermittent preventive treatment with dihydroartemisinin-piperaquine. METHODS: We did this open-label, three-group, randomised controlled superiority trial at four sites in western Kenya with high malaria transmission and sulfadoxine-pyrimethamine resistance. HIV-negative pregnant women between 16 and 32 weeks' gestation were randomly assigned (1:1:1), via computer-generated permuted-block randomisation (block sizes of three, six, and nine), to receive intermittent screening and treatment with dihydroartemisinin-piperaquine, intermittent preventive treatment with dihydroartemisinin-piperaquine, or intermittent preventive treatment with sulfadoxine-pyrimethamine. Study participants, study clinic nurses, and the study coordinator were aware of treatment allocation, but allocation was concealed from study investigators, delivery unit nurses, and laboratory staff. The primary outcome was malaria infection at delivery, defined as a composite of peripheral or placental parasitaemia detected by placental histology, microscopy, or rapid diagnostic test. The primary analysis was by modified intention to treat. This study is registered with ClinicalTrials.gov, number NCT01669941. FINDINGS: Between Aug 21, 2012, and June 19, 2014, we randomly assigned 1546 women to receive intermittent screening and treatment with dihydroartemisinin-piperaquine (n=515), intermittent preventive treatment with dihydroartemisinin-piperaquine (n=516), or intermittent preventive treatment with sulfadoxine-pyrimethamine (n=515); 1368 (88%) women comprised the intention-to-treat population for the primary endpoint. Prevalence of malaria infection at delivery was lower in the intermittent preventive treatment with dihydroartemisinin-piperaquine group than in the intermittent preventive treatment with sulfadoxine-pyrimethamine group (15 [3%] of 457 women vs 47 [10%] of 459 women; relative risk 0.32, 95% CI 0.18-0.56; p<0.0001), but not in the intermittent screening and treatment with dihydroartemisinin-piperaquine group (57 [13%] of 452 women; 1.23, 0.86-1.77; p=0.26). Compared with intermittent preventive treatment with sulfadoxine-pyrimethamine, intermittent preventive treatment with dihydroartemisinin-piperaquine was associated with a lower incidence of malaria infection during pregnancy (192.0 vs 54.4 events per 100 person-years; incidence rate ratio [IRR] 0.28, 95% CI 0.22-0.36; p<0.0001) and clinical malaria during pregnancy (37.9 vs 6.1 events; 0.16, 0.08-0.33; p<0.0001), whereas intermittent screening and treatment with dihydroartemisinin-piperaquine was associated with a higher incidence of malaria infection (232.0 events; 1.21, 1.03-1.41; p=0.0177) and clinical malaria (53.4 events; 1.41, 1.00-1.98; p=0.0475). We recorded 303 maternal and infant serious adverse events, which were least frequent in the intermittent preventive treatment with dihydroartemisinin-piperaquine group. INTERPRETATION: At current levels of rapid diagnostic test sensitivity, intermittent screening and treatment is not a suitable alternative to intermittent preventive treatment with sulfadoxine-pyrimethamine in the context of high sulfadoxine-pyrimethamine resistance and malaria transmission. However, dihydroartemisinin-piperaquine is a promising alternative drug to replace sulfadoxine-pyrimethamine for intermittent preventive treatment. Future studies should investigate the efficacy, safety, operational feasibility, and cost-effectiveness of intermittent preventive treatment with dihydroartemisinin-piperaquine. FUNDING: The Malaria in Pregnancy Consortium, which is funded through a grant from the Bill & Melinda Gates Foundation to the Liverpool School of Tropical Medicine.","2015-12","2024-01-16 12:27:56","2024-01-16 12:27:56","","2507-19","","10012","386","","","","","","","","","","","","","","","","","Place: England","<div data-schema-version=""8""><p><strong>Location Information</strong></p> <p><strong><span style=""color: black""><span style=""background-color: white"">Location Name :</span></span></strong></p> <p><span style=""color: black""><span style=""background-color: white"">Names not specified</span></span></p> <p><strong><span style=""color: black""><span style=""background-color: white"">Location Type :</span></span></strong></p> <p><span style=""color: black""><span style=""background-color: white"">Health facilities</span></span></p> <p><strong><span style=""color: black""><span style=""background-color: white"">Description :</span></span></strong></p> <p><span style=""color: rgb(13, 13, 13)""><span style=""background-color: rgb(255, 255, 255)"">Conducted at four sites in western Kenya</span></span></p> <p><strong><span style=""color: black""><span style=""background-color: white"">Sample size : &nbsp;</span></span></strong></p> <p><span style=""color: black""><span style=""background-color: white"">1546</span></span></p> </div>","","","eppi-reviewer4; Adult; Female; Humans; Pregnancy; Young Adult; Risk Factors; Drug Combinations; Treatment Outcome; Adolescent; Antimalarials/*administration & dosage; Artemisinins/*administration & dosage; Kenya; Pyrimethamine/*administration & dosage; Sulfadoxine/*administration & dosage; Drug Therapy, Combination; Malaria/diagnosis/drug therapy/*prevention & control; Mass Screening/methods; Pregnancy Complications, Parasitic/diagnosis/drug therapy/*prevention & control; Prenatal Diagnosis/methods; Quinolines/*administration & dosage","","","","","","","","","","","","","","","","","","","","","","","","","","","","","","","","","","","","","","","","","","","","","","",""
"CGWU4SNW","journalArticle","2016","Dellicour S; Aol G; Ouma P; Yan N; Bigogo G; Hamel MJ; Burton DC; Oneko M; Breiman RF; Slutsker L; Feikin D; Kariuki S; Odhiambo F; Calip G; Stergachis A; Laserson KF; ter Kuile FO; Desai M","Weekly miscarriage rates in a community-based prospective cohort study in rural western Kenya.","BMJ open","","2044-6055 (Linking)","10.1136/bmjopen-2016-011088","","OBJECTIVE: Information on adverse pregnancy outcomes is important to monitor the impact of public health interventions. Miscarriage is a challenging end point to ascertain and there is scarce information on its rate in low-income countries. The objective was to estimate the background rate and cumulative probability of miscarriage in rural western Kenya. DESIGN: This was a population-based prospective cohort. PARTICIPANTS AND SETTING: Women of childbearing age were followed prospectively to identify pregnancies and ascertain their outcomes in Siaya County, western Kenya. The cohort study was carried out in 33 adjacent villages under health and demographic surveillance. OUTCOME MEASURE: Miscarriage. RESULTS: Between 2011 and 2013, among 5536 women of childbearing age, 1453 pregnancies were detected and 1134 were included in the analysis. The cumulative probability was 18.9%. The weekly miscarriage rate declined steadily with increasing gestation until approximately 20 weeks. Known risk factors for miscarriage such as maternal age, gravidity, occupation, household wealth and HIV infection were confirmed. CONCLUSIONS: This is the first report of weekly miscarriage rates in a rural African setting in the context of high HIV and malaria prevalence. Future studies should consider the involvement of community health workers to identify the pregnancy cohort of early gestation for better data on the actual number of pregnancies and the assessment of miscarriage.","2016-04","2024-01-16 12:27:56","2024-01-16 12:27:56","","e011088","","4","6","","","","","","","","","","","","","","","","","Place: England","<div data-schema-version=""8""><p><strong>Location Information</strong></p> <p><strong><span style=""color: var(--tw-prose-bold)""><span style=""background-color: rgb(255, 255, 255)"">Location Name :</span></span></strong></p> <p><span style=""color: rgb(13, 13, 13)""><span style=""background-color: rgb(255, 255, 255)"">Siaya County</span></span></p> <p><strong><span style=""color: var(--tw-prose-bold)""><span style=""background-color: rgb(255, 255, 255)"">Location Type :</span></span></strong><span style=""background-color: rgb(255, 255, 255)""> &nbsp;</span></p> <p><span style=""background-color: rgb(255, 255, 255)"">Community</span></p> <p><strong><span style=""color: var(--tw-prose-bold)""><span style=""background-color: rgb(255, 255, 255)"">Description :</span></span></strong><span style=""background-color: rgb(255, 255, 255)""> &nbsp;</span></p> <p><span style=""color: rgb(13, 13, 13)""><span style=""background-color: rgb(255, 255, 255)"">Conducted in 33 adjacent villages under the Kenya Medical Research Institute-Centers for Disease Control and Prevention (KEMRI-CDC) Health and Demographic Surveillance System area (KEMRI-CDC HDSS), </span></span><span style=""background-color: rgb(255, 255, 255)"">in </span><span style=""color: rgb(13, 13, 13)""><span style=""background-color: rgb(255, 255, 255)"">Siaya County, western Kenya.</span></span></p> <p><strong><span style=""color: var(--tw-prose-bold)""><span style=""background-color: rgb(255, 255, 255)"">Sample size :</span></span></strong></p> <p><span style=""background-color: rgb(255, 255, 255)"">1453 pregnancies recruited Siaya County, western Kenya</span></p> </div>","","","eppi-reviewer4; Adult; Female; Humans; Pregnancy; *Rural Population; Prospective Studies; Young Adult; Risk Factors; Prevalence; *Developing Countries; Socioeconomic Factors; Adolescent; Kenya/epidemiology; Kenya; Age Factors; Pregnancy Complications/epidemiology; sub-Saharan Africa; *Abortion, Spontaneous; Gravidity; HIV Infections/complications/epidemiology; Miscarriage; prospective cohort; rate","","","","","","","","","","","","","","","","","","","","","","","","","","","","","","","","","","","","","","","","","","","","","","",""
"BDBHLSEY","journalArticle","2020","Debelew GT","Magnitude and Determinants of Perinatal Mortality in Southwest Ethiopia.","Journal of pregnancy","","2090-2727 (Linking)","10.1155/2020/6859157","","Despite several efforts globally, the problem of perinatal mortality remained an unsolved agenda. As a result, it continued to be an essential part of the third sustainable development goals to end preventable child deaths by 2030. With a rate of 33 per 1000 births, Ethiopia has the highest level of perinatal mortality in the world. Thus, determining the magnitude and identifying the determinants are very crucial for evidence-based interventions. A community-based longitudinal study was conducted in Southwest Ethiopia among 3474 pregnant women to estimate the magnitude of perinatal mortality. Then, a case-control study among 120 cases and 360 controls was conducted to identify the determinants of perinatal mortality. Data were collected by using an interviewer-administered questionnaire and analyzed by using SPSS version 20. Multivariate logistic regression analysis was used to identify variables having a significant association with perinatal mortality at p < 0.05. The perinatal mortality rate was 34.5 (95% CI: 28.9, 41.1) deaths per 1000 births. Attending >/=4 ANC visits (AOR = 0.46; 95% CI: 0.23, 0.91), having good knowledge on key danger signs (AOR = 0.27; 95% CI: 0.10, 0.75), and having a skilled attendant at birth (AOR = 0.34; 95% CI: 0.19, 0.61) were significantly associated with a reduction of perinatal mortality. Being a primipara (AOR = 3.38; 95% CI: 1.90, 6.00), twin births (AOR = 5.29; 95% CI: 1.46, 19.21), previous history of perinatal mortality (AOR = 3.33; 95% CI: 1.27, 8.72), and obstetric complication during labor (AOR = 4.27; 95% CI: 2.40, 7.59) significantly increased perinatal mortality. In conclusion, the magnitude of perinatal mortality in the study area was high as compared to the national target for 2020. Care during pregnancy and childbirth and conditions of pregnancy and labor were identified as determinants of perinatal mortality. Hence, interventions need to focus on increasing knowledge of danger signs and utilization of skilled maternity care. Special emphasis needs to be given to mothers with a previous history of perinatal mortality, twin pregnancies, and having obstetric complications.","2020","2024-01-16 12:27:56","2024-01-16 12:27:56","","6859157","","","2020","","","","","","","","","","","","","","","","","Place: Egypt","<div data-schema-version=""8""><p><strong>Location Information</strong></p> <p><strong><span style=""color: black""><span style=""background-color: white"">Location Name : &nbsp;</span></span></strong></p> <p><span style=""color: rgb(13, 13, 13)""><span style=""background-color: rgb(255, 255, 255)"">Names not specified</span></span></p> <p><strong><span style=""color: black""><span style=""background-color: white"">Location Type :</span></span></strong></p> <p>Community</p> <p><strong><span style=""color: black""><span style=""background-color: white"">Description :</span></span></strong></p> <p><span style=""color: rgb(13, 13, 13)""><span style=""background-color: rgb(255, 255, 255)"">conducted in Jimma Zone, Southwest Ethiopia,</span></span></p> <p><strong>Sample Size :</strong> &nbsp;</p> <p>3474</p> </div>","","","eppi-reviewer4; Female; Humans; Pregnancy; Infant, Newborn; Male; Risk Factors; Longitudinal Studies; Logistic Models; Infant; Surveys and Questionnaires; *Perinatal Care; Case-Control Studies; Ethiopia/epidemiology; Parity; *Perinatal Mortality; Clinical Competence; Knowledge; Obstetric Labor Complications; Pregnancy, Twin","","","","","","","","","","","","","","","","","","","","","","","","","","","","","","","","","","","","","","","","","","","","","","",""
"PBEDD3ZD","journalArticle","2020","de Beer S; Kalk E; Kroon M; Boulle A; Osler M; Euvrard J; Timmerman V; Davies MA","A longitudinal analysis of the completeness of maternal HIV testing, including repeat testing in Cape Town, South Africa.","Journal of the International AIDS Society","","1758-2652 (Linking)","10.1002/jia2.25441","","INTRODUCTION: The virtual elimination of mother-to-child transmission of HIV cannot be achieved without complete maternal HIV testing. The World Health Organization recommends that women in high HIV prevalent settings repeat HIV testing in the third trimester, and at delivery or directly thereafter. The Western Cape Province (South Africa) prevention of mother-to-child transmission (PMTCT) guidelines recommend a repeat maternal HIV test between 32 and 34 weeks gestation and at delivery in addition to testing at the first antenatal visit (ideally <20 weeks gestation). There are few published longitudinal studies on the uptake of initial and repeated maternal HIV testing programmes in sub-Saharan Africa. We aimed to investigate the implementation of initial and repeat maternal HIV testing guidelines in Cape Town, South Africa. METHODS: Between 2013 and 2016 we established an electronic PMTCT register that consolidated routine data from a primary healthcare facility and its secondary and tertiary referral sites in Cape Town. This provided a longitudinal record for each participant, from first antenatal visit to delivery. Utilizing these data, we conducted a retrospective analysis investigating the completeness of maternal HIV testing according to the PMTCT HIV testing guidelines in Cape Town, and predictors of complete testing, from 2014 to 2016. RESULTS: Among 8558 enrolled pregnant women, 7213 (84%) were not known to be HIV positive at their first visit and thus eligible for HIV testing; 91% of them received >/=1 HIV test during pregnancy/delivery. Testing at the first visit was 98% among the 85% of women who attended antenatal care. Among women eligible to receive all three recommended HIV tests, only 11% achieved all three tests. Delivery HIV testing completion among all women without an HIV-positive diagnosis was 23%. HIV prevalence at delivery was 21% and HIV incidence between first visit and delivery in those with >/=2 HIV tests was 0.2%. Women who enrolled after 2014 were more likely to receive the three recommended tests (aOR: 1.41; 95% CI: 1.10 to 1.81) and retest at delivery (aOR: 1.20; 95% CI: 1.05 to 1.39). CONCLUSIONS: Implementation of maternal HIV testing in Cape Town improved between 2014 and 2016 but major gaps remain, particularly at delivery.","2020-01","2024-01-16 12:27:56","2024-01-16 12:27:56","","e25441","","1","23","","","","","","","","","","","","","","","","","Place: Switzerland","<div data-schema-version=""8""><p><strong>Location Information</strong></p> <p><strong><span style=""color: black""><span style=""background-color: white"">Location Name : &nbsp;</span></span></strong></p> <p><span style=""color: rgb(13, 13, 13)""><span style=""background-color: rgb(255, 255, 255)"">Mitchells Plain/Mitchells Plain Sub-Structure, Mitchells Plain Midwife Obstetric Unit (MPMOU), MPMOU, ,Mitchells Plain District Hospital (MPDH), Mowbray Maternity Hospital (MMH), Groote Schuur Hospital (GSH).</span></span></p> <p><strong><span style=""color: black""><span style=""background-color: white"">Location Type :</span></span></strong></p> <p><span style=""color: black""><span style=""background-color: white"">Health facilities</span></span></p> <p><strong><span style=""color: black""><span style=""background-color: white"">Description :</span></span></strong></p> <p><span style=""color: rgb(13, 13, 13)""><span style=""background-color: rgb(255, 255, 255)"">Conducted within the Western Cape province of South Africa, specifically focusing on the Mitchells Plain/Mitchells Plain Sub-Structure. The primary health facility involved in the study is the Mitchells Plain Midwife Obstetric Unit (MPMOU), which is located within the Mitchells Plain Community Health Centre. Additionally, the study utilized data from referral sites associated with MPMOU, including Mitchells Plain District Hospital (MPDH), Mowbray Maternity Hospital (MMH), and Groote Schuur Hospital (GSH).</span></span></p> <p><strong>Sample Size : </strong>&nbsp;</p> <p>8558</p> <p></p> <p></p> </div>","","","*HIV; *South Africa; eppi-reviewer4; *PMTCT; *guideline implementation; *maternal HIV testing; *repeat testing","","","","","","","","","","","","","","","","","","","","","","","","","","","","","","","","","","","","","","","","","","","","","","",""
"QZAE3LQP","journalArticle","2017","Darling AM; McDonald CR; Urassa WS; Kain KC; Mwiru RS; Fawzi WW","Maternal Dietary L-Arginine and Adverse Birth Outcomes in Dar es Salaam, Tanzania.","American journal of epidemiology","","0002-9262 (Linking)","10.1093/aje/kwx080","","The amino acid arginine is a physiological precursor to nitric oxide, which is a key mediator of embryonic survival, fetal growth, and pregnancy maintenance. We evaluated the association between consumption of the amino acid arginine and the rate of adverse birth outcomes using data from a double-blind, randomized, placebo-controlled micronutrient supplementation trial among pregnant women in Dar es Salaam, Tanzania (2001-2004). Dietary intakes of arginine were assessed using repeated 24-hour recalls that were administered throughout pregnancy. Participants (n = 7,591) were monitored by research midwives throughout follow-up to assess pregnancy outcomes. Cubic-restricted splines and multivariable log-Poisson regression with empirical standard errors were used to estimate the continuous and categorical associations between arginine intake and adverse birth outcomes. Compared with women within the lowest quintile of arginine intake, those within the highest quintile had 0.79 times the risk of preterm birth before 37 weeks (95% confidence interval: 0.63, 1.00; P = 0.03). The continuous associations of arginine intake with preterm birth before 37 weeks and with preterm birth before 34 weeks were characterized by an initial rapid decrease in risk with increasing intake (P for nonlinearity < 0.01). Arginine intake was not associated with fetal loss or giving birth to infants who were born small for their gestational ages. This data suggest that the association between dietary arginine intake and preterm birth warrants further investigation.","2017-09","2024-01-16 12:27:56","2024-01-16 12:27:56","","603-611","","5","186","","","","","","","","","","","","","","","","","Place: United States","<div data-schema-version=""8""><p><strong>Location Information</strong></p> <p><strong>Location Name</strong> <strong>:</strong></p> <p>Names not specified</p> <p><strong>Location Type</strong> <strong>:</strong></p> <p>Health facilities (antenatal clinics)</p> <p><strong>Description</strong> <strong>:</strong></p> <p><span style=""color: rgb(13, 13, 13)""><span style=""background-color: rgb(255, 255, 255)"">Conducted in Dar es Salaam, Tanzania</span></span></p> <p><strong>Sample size</strong> <strong>:</strong></p> <p><span style=""color: rgb(42, 42, 42)""><span style=""background-color: rgb(255, 255, 255)"">7,591</span></span></p> <p></p> </div>","","","eppi-reviewer4; Female; Humans; Pregnancy; Infant, Newborn; Prospective Studies; Pregnancy Outcome/*epidemiology; Tanzania; Tanzania/epidemiology; birth outcomes; pregnancy; Randomized Controlled Trials as Topic; Premature Birth/*epidemiology/prevention & control; *Diet; arginine; Arginine/administration & dosage/*physiology; Dietary Supplements/statistics & numerical data; Micronutrients/administration & dosage/physiology; nutrition; Poisson Distribution","","","","","","","","","","","","","","","","","","","","","","","","","","","","","","","","","","","","","","","","","","","","","","",""
"T3G8B6FU","journalArticle","2021","Cohen J","'Landmark' African vaccine trial faces impasse.","Science (New York, N.Y.)","","0036-8075 (Linking)","10.1126/science.372.6547.1135","","","2021-06","2024-01-16 12:27:56","2024-01-16 12:27:56","","1135-1136","","6547","372","","","","","","","","","","","","","","","","","Place: United States","<div data-schema-version=""8""><p><strong>Location Information</strong></p> <p><strong>Location Name : </strong>Names not specified</p> <p><strong>Location Type : </strong><span style=""color: rgb(13, 13, 13)""><span style=""background-color: rgb(255, 255, 255)"">Health facilities and research centers</span></span></p> <p><strong>Description : </strong><span style=""color: rgb(13, 13, 13)""><span style=""background-color: rgb(255, 255, 255)"">The trial is planned to take place in several African countries, including South Africa, Eswatini, Botswana, Zimbabwe, Malawi, Zambia, Uganda, and Kenya.</span></span></p> <p><strong>Sample size :</strong> &nbsp;14000</p> </div>","","","eppi-reviewer4; Female; Humans; Pregnancy; Africa South of the Sahara; Randomized Controlled Trials as Topic; HIV Infections/complications; Pregnancy Complications, Infectious/prevention & control; *COVID-19 Vaccines/immunology; *SARS-CoV-2/immunology; *Vaccines, Synthetic/immunology; 2019-nCoV Vaccine mRNA-1273; BNT162 Vaccine; Coinfection; COVID-19/complications/*prevention & control/virology","","","","","","","","","","","","","","","","","","","","","","","","","","","","","","","","","","","","","","","","","","","","","","",""
