"PAYT92WV","journalArticle","2022","Webber G; Chirangi B; Magatti N; Mallick R; Taljaard M","Improving health care facility birth rates in Rorya District, Tanzania: a multiple baseline trial.","BMC pregnancy and childbirth","","1471-2393 (LINKING)","10.1186/s12884-022-04408-5","","BACKGROUND: Rates of maternal mortality and morbidity in Africa remain unacceptably high, as many women deliver at home, without access to skilled birth attendants and life-saving medications. In rural Tanzania, women face significant barriers accessing health care facilities for their deliveries. METHODS: From January 2017 to February 2019 we conducted a multiple baseline (interrupted time series) trial within the four divisions of Rorya District, Tanzania. We collected baseline data, then sequentially introduced a complex intervention in each of the divisions, in randomized order, over 3 month intervals. We allowed for a 6 month transition period to avoid contamination between the pre- and post-intervention periods. The intervention included using community health workers to educate about safe delivery, distribution of birth kits with misoprostol, and a transport subsidy for women living a distance from the health care facility. The primary outcome was the health facility birth rate, while the secondary outcomes were the rates of antenatal and postpartum care and postpartum hemorrhage. Outcomes were analyzed using fixed effects segmented logistic regression, adjusting for age, marital status, education, and parity. Maternal and baby morbidity/mortality were analyzed descriptively. RESULTS: We analyzed data from 9565 pregnant women (2634 before and 6913 after the intervention was implemented). Facility births increased from 1892 (71.8%) before to 5895 (85.1%) after implementation of the intervention. After accounting for the secular trend, the intervention was associated with an immediate increase in the odds of facility births (OR = 1.51, 95% CI 1.14 to 2.01, p = 0.0045) as well as a small gradual effect (OR = 1.03 per month, 95% CI 1.00 to 1.07, p = 0.0633). For the secondary outcomes, there were no statistically significant immediate changes associated with the intervention. Rates of maternal and baby morbidity/mortality were low and similar between the pre- and post-implementation periods. CONCLUSIONS: Access to health care facilities can be improved through implementation of education of the population by community health workers about the importance of a health care facility birth, provision of birth kits with misoprostol to women in late pregnancy, and access to a transport subsidy for delivery for women living at a distance from the health facility. CLINICAL TRIALS REGISTRATION: NCT03024905 19/01/2017.","2022-01","2024-02-20 10:59:27","2024-02-20 10:59:27","","74","","1","22","","","","","","","","","","","","","","","","","Number: 1 Place: England","<div data-schema-version=""8""><p><strong>Location Information</strong></p> <p><strong>Location Name :</strong></p> <p><span style=""color: rgb(51, 51, 51)""><span style=""background-color: rgb(255, 255, 255)"">Nyancha </span></span>Health facility<span style=""color: rgb(51, 51, 51)""><span style=""background-color: rgb(255, 255, 255)"">, Girango </span></span>Health facility<span style=""color: rgb(51, 51, 51)""><span style=""background-color: rgb(255, 255, 255)"">, Suba </span></span>Health facility <span style=""color: rgb(51, 51, 51)""><span style=""background-color: rgb(255, 255, 255)"">,Luoimbo&nbsp;</span></span>Health facilit</p> <p><strong>Location Type :</strong></p> <p>Health facilities and communities</p> <p><strong>Description : </strong><span style=""color: rgb(51, 51, 51)""><span style=""background-color: rgb(255, 255, 255)"">&nbsp;</span></span></p> <p><span style=""color: rgb(51, 51, 51)""><span style=""background-color: rgb(255, 255, 255)"">Rorya District consists of four divisions: Nyancha, Girango, Suba and Luoimbo&nbsp;</span></span></p> <p><strong>sample size :</strong></p> <p><span style=""color: rgb(51, 51, 51)""><span style=""background-color: rgb(255, 255, 255)"">9565&nbsp;</span></span></p> </div>","","","eppi-reviewer4; Adult; Female; Humans; Pregnancy; Young Adult; Infant; Middle Aged; Adolescent; Rural Population; Tanzania; Child; Tanzania/epidemiology; *Delivery, Obstetric; Research Design; Misoprostol; *Health Services Accessibility; *Birth Rate; *Health Facilities; Birth kits; Community health worker; Community Health Workers/education; Facility birth; Health Education/*methods; M-health; Postnatal Care/trends; Prenatal Care/trends; Social Determinants of Health; Transportation","","","","","","","","","","","","","","","","","","","","","","","","","","","","","","","","","","","","","","","","","","","","","","",""
"AY2BZTL2","journalArticle","2016","Cleeve A; Byamugisha J; Gemzell-Danielsson K; Mbona Tumwesigye N; Atuhairwe S; Faxelid E; Klingberg-Allvin M","Women's Acceptability of Misoprostol Treatment for Incomplete Abortion by Midwives and Physicians - Secondary Outcome Analysis from a Randomized Controlled Equivalence Trial at District Level in Uganda.","PloS one","","1932-6203 (LINKING)","10.1371/journal.pone.0149172","","OBJECTIVE: This study aimed to assess women s acceptability of diagnosis and treatment of incomplete abortion with misoprostol by midwives, compared with physicians. METHODS: This was an analysis of secondary outcomes from a multi-centre randomized controlled equivalence trial at district level in Uganda. Women with first trimester incomplete abortion were randomly allocated to clinical assessment and treatment with misoprostol by a physician or a midwife. The randomisation (1:1) was done in blocks of 12 and stratified for health care facility. Acceptability was measured in expectations and satisfaction at a follow up visit 14-28 days following treatment. Analysis of women's overall acceptability was done using a generalized linear mixed-effects model with an equivalence range of -4% to 4%. The study was not masked. The trial is registered at ClinicalTrials.org, NCT 01844024. RESULTS: From April 2013 to June 2014, 1108 women were assessed for eligibility of which 1010 were randomized (506 to midwife and 504 to physician). 953 women were successfully followed up and included in the acceptability analysis. 95% (904) of the participants found the treatment satisfactory and overall acceptability was found to be equivalent between the two study groups. Treatment failure, not feeling calm and safe following treatment, experiencing severe abdominal pain or heavy bleeding following treatment, were significantly associated with non-satisfaction. No serious adverse events were recorded. CONCLUSIONS: Treatment of incomplete abortion with misoprostol by midwives and physician was highly, and equally, acceptable to women. TRIAL REGISTRATION: ClinicalTrials.gov NCT01844024.","2016","2024-02-20 10:59:26","2024-02-20 10:59:26","","e0149172","","2","11","","","","","","","","","","","","","","","","","Number: 2 Place: United States","<div data-schema-version=""8""><p><strong>Location Information</strong></p> <p><strong>Location Name :</strong></p> <p>Names not specified</p> <p><strong>Location Type :</strong></p> <p>health facility</p> <p><strong>Description :</strong></p> <p><span style=""color: rgb(32, 32, 32)""><span style=""background-color: rgb(255, 255, 255)"">Six different health care facilities in &nbsp;rural, peri-urban and urban settings of central Uganda</span></span></p> <p><strong>Sample size :</strong></p> <p><span style=""color: rgb(32, 32, 32)""><span style=""background-color: rgb(255, 255, 255)"">1108&nbsp;</span></span></p> </div>","","","eppi-reviewer4; Adult; Female; Humans; Uganda/epidemiology; Midwifery; Abortifacient Agents, Nonsteroidal/adverse effects/*therapeutic use; Abortion, Incomplete/*drug therapy/epidemiology; Misoprostol/adverse effects/*therapeutic use","","","","","","","","","","","","","","","","","","","","","","","","","","","","","","","","","","","","","","","","","","","","","","",""
"5PZQKC7W","journalArticle","2014","De Schacht C; Hoffman HJ; Mabunda N; Lucas C; Alons CL; Madonela A; Vubil A; Ferreira OC Jr; Calu N; Santos IS; Jani IV; Guay L","High rates of HIV seroconversion in pregnant women and low reported levels of HIV testing among male partners in Southern Mozambique: results from a mixed methods study.","PloS one","","1932-6203 (LINKING)","10.1371/journal.pone.0115014","","INTRODUCTION: Prevention of acute HIV infections in pregnancy is required to achieve elimination of pediatric HIV. Identification and support for HIV negative pregnant women and their partners, particularly serodiscordant couples, are critical. A mixed method study done in Southern Mozambique estimated HIV incidence during pregnancy, associated risk factors and factors influencing partner's HIV testing. METHODS: Between April 2008 and November 2011, a prospective cohort of 1230 HIV negative pregnant women was followed during pregnancy. A structured questionnaire, HIV testing, and collection of dried blood spots were done at 2-3 scheduled visits. HIV incidence rates were calculated by repeat HIV testing and risk factors assessed by Poisson regression. A qualitative study including 37 individual interviews with men, women, and nurses and 11 focus group discussions (n = 94) with men, women and grandmothers explored motivators and barriers to uptake of male HIV testing. RESULTS: HIV incidence rate was estimated at 4.28/100 women-years (95%CI: 2.33-7.16). Significant risk factors for HIV acquisition were early sexual debut (RR 3.79, 95%CI: 1.04-13.78, p = 0.04) and living in Maputo Province (RR 4.35, 95%CI: 0.97-19.45, p = 0.05). Nineteen percent of women reported that their partner had tested for HIV (93% knew the result with 8/213 indicating an HIV positive partner), 56% said their partner had not tested and 19% did not know their partner test status. Of the 14 seroconversions, only one reported being in a serodiscordant relationship. Fear of discrimination or stigma was reported as a key barrier to male HIV testing, while knowing the importance of getting tested and receiving care was the main motivator. CONCLUSIONS: HIV incidence during pregnancy is high in Southern Mozambique, but knowledge of partners' HIV status remains low. Knowledge of both partners' HIV status is critical for maximal effectiveness of prevention and treatment services to reach elimination of pediatric HIV/AIDS.","2014","2024-02-20 10:59:26","2024-02-20 10:59:26","","e115014","","12","9","","","","","","","","","","","","","","","","","Number: 12 Place: United States","<div data-schema-version=""8""><p><strong>Location Information</strong></p> <p><strong>Location Name</strong> <strong>:</strong></p> <p><span style=""color: rgb(32, 32, 32)""><span style=""background-color: rgb(255, 255, 255)"">Chibuto </span></span>Health facility<span style=""color: rgb(32, 32, 32)""><span style=""background-color: rgb(255, 255, 255)"">, Chicumbane </span></span>Health facility<span style=""color: rgb(32, 32, 32)""><span style=""background-color: rgb(255, 255, 255)""> ,Malehice </span></span>Health facility<span style=""color: rgb(32, 32, 32)""><span style=""background-color: rgb(255, 255, 255)"">,Marracuene </span></span>Health facility<span style=""color: rgb(32, 32, 32)""><span style=""background-color: rgb(255, 255, 255)"">, Moamba </span></span>Health facility<span style=""color: rgb(32, 32, 32)""><span style=""background-color: rgb(255, 255, 255)""> , Boane </span></span>Health facility</p> <p><strong>Location Type</strong> <strong>:</strong></p> <p>Health facilities</p> <p><strong>Description</strong> <strong>:</strong></p> <p><span style=""color: rgb(32, 32, 32)""><span style=""background-color: rgb(255, 255, 255)"">Six rural health facilities and their surrounding communities in Gaza (Chibuto, Chicumbane and Malehice) and Maputo (Marracuene, Moamba and Boane) provinces in Southern Mozambiqu</span></span></p> <p><strong>Sample size</strong> <strong>:</strong></p> <p><span style=""color: rgb(32, 32, 32)""><span style=""background-color: rgb(255, 255, 255)"">1230</span></span></p> </div>","","","eppi-reviewer4; Adult; Female; Humans; Incidence; Pregnancy; Prospective Studies; Young Adult; Male; Risk Factors; Sexual Partners; Mozambique/epidemiology; Interviews as Topic; Early Diagnosis; HIV Seropositivity/*diagnosis/*epidemiology","","","","","","","","","","","","","","","","","","","","","","","","","","","","","","","","","","","","","","","","","","","","","","",""
"QUMEJ237","journalArticle","2015","Jack DW; Asante KP; Wylie BJ; Chillrud SN; Whyatt RM; Ae-Ngibise KA; Quinn AK; Yawson AK; Boamah EA; Agyei O; Mujtaba M; Kaali S; Kinney P; Owusu-Agyei S","Ghana randomized air pollution and health study (GRAPHS): study protocol for a randomized controlled trial.","Trials","","1745-6215 (LINKING)","10.1186/s13063-015-0930-8","","BACKGROUND: Household air pollution exposure is a major health risk, but validated interventions remain elusive. METHODS/DESIGN: The Ghana Randomized Air Pollution and Health Study (GRAPHS) is a cluster-randomized trial that evaluates the efficacy of clean fuels (liquefied petroleum gas, or LPG) and efficient biomass cookstoves in the Brong-Ahafo region of central Ghana. We recruit pregnant women into LPG, efficient cookstove, and control arms and track birth weight and physician-assessed severe pneumonia incidence in the first year of life. A woman is eligible to participate if she is in the first or second trimester of pregnancy and carrying a live singleton fetus, if she is the primary cook, and if she does not smoke. We hypothesize that babies born to intervention mothers will weigh more and will have fewer cases of physician-assessed severe pneumonia in the first year of life. Additionally, an extensive personal air pollution exposure monitoring effort opens the way for exposure-response analyses, which we will present alongside intention-to-treat analyses. Major funding was provided by the National Institute of Environmental Health Sciences, The Thrasher Research Fund, and the Global Alliance for Clean Cookstoves. DISCUSSION: Household air pollution exposure is a major health risk that requires well-tested interventions. GRAPHS will provide important new evidence on the efficacy of both efficient biomass cookstoves and LPG, and will thus help inform health and energy policies in developing countries. TRIAL REGISTRATION: The trial was registered with clinicaltrials.gov on 13 April 2011 with the identifier NCT01335490 .","2015-09","2024-02-20 10:59:25","2024-02-20 10:59:25","","420","","","16","","","","","","","","","","","","","","","","","Place: England","<div data-schema-version=""8""><p><strong>Location &nbsp;information</strong></p> <p><strong>Location Name</strong> <strong>: </strong></p> <p>Names not specified</p> <p><strong>Location Type</strong> <strong>: </strong></p> <p><span style=""color: rgb(51, 51, 51)""><span style=""background-color: rgb(255, 255, 255)"">Communities&nbsp;&nbsp;</span></span></p> <p><strong>Description</strong> <strong>: </strong></p> <p><span style=""color: rgb(51, 51, 51)""><span style=""background-color: rgb(255, 255, 255)"">Thirty-five rural communities&nbsp;&nbsp; in Kintampo North and South districts, Brong-Ahafo region of central Ghana, West Africa.</span></span></p> <p><strong>Sample size</strong> <strong>: </strong></p> <p><span style=""color: rgb(51, 51, 51)""><span style=""background-color: rgb(255, 255, 255)"">1225&nbsp;</span></span></p> <p></p> </div>","","","eppi-reviewer4; Female; Humans; Incidence; Pregnancy; Birth Weight; Infant, Newborn; Risk Factors; Ghana/epidemiology; Infant; Time Factors; Research Design; *Biomass; *Housing; Air Pollution, Indoor/*adverse effects/prevention & control; Cooking/*instrumentation; Equipment Design; Gases; Inhalation Exposure/*adverse effects/prevention & control; Petroleum/*adverse effects; Pneumonia/diagnosis/epidemiology","","","","","","","","","","","","","","","","","","","","","","","","","","","","","","","","","","","","","","","","","","","","","","",""
"YGU4HM6Y","journalArticle","2012","Linguissi LS; Bisseye C; Sagna T; Nagalo BM; Ouermi D; Djigma FW; Pignatelli S; Sia JD; Pietra V; Moret R; Nikiema JB; Simpore J","Efficiency of HAART in the prevention of mother to children HIV-1 transmission at Saint Camille medical centre in Burkina Faso, West Africa.","Asian Pacific journal of tropical medicine","","1995-7645 (LINKING)","10.1016/S1995-7645(12)60188-6","","OBJECTIVE: To evaluate efficiency of HAART in the prevention of mother to child HIV transmission. METHODS: A longitudinal study was conducted on 1 300 women attending the antenatal service at Saint Camille Medical Centre from September 2010 to July 2011. The HIV status of mothers was determined by rapid tests and ELISA. Discordant results were confirmed by real-time PCR. PCR was used to determine HIV status of children born from HIV-positive mothers. RESULTS: Among 1 300 pregnant women tested for HIV, 378 were seropositive. Mothers were predominantly housewives (69.7%), and their mean age was (28.32+/-0.15) years. The overall prevalence of HIV transmission from mother to child was 4.8% (18/378). This prevalence differed significantly from 0.0% (0/114) to 6.8% (18/264) in children born from mothers under HAART and those with mothers under New Prophylactic Protocol (AZT + 3TC + NVP), respectively (P< 0.01). Children's mortality rate during the medical follow up was 1.3% (5/378). Among 16 women with HIV dubious status by ELISA, the Real Time PCR confirmed 2/16 (12.5%) as HIV positive. CONCLUSIONS: The protocol of prevention of mother to children HIV transmission (PMTCT) is effective. The rate of HIV vertical transmission is significantly reduced. Early diagnosis determined by PCR of children born from HIV-positive mother is necessary and recommended in the context of PMTCT in Burkina Faso. We also found that PCR is an effective tool to confirm HIV status in pregnant women.","2012-12","2024-02-20 10:59:25","2024-02-20 10:59:25","","991-4","","12","5","","","","","","","","","","","","","","","","","Number: 12 Place: India","<div data-schema-version=""8""><p><strong>Location Information</strong></p> <p><strong>Location Name</strong> <strong>:</strong></p> <p>Saint Camille Medical Centre , Biomolecular Research Centre Pietro Annigoni / Ouagadougou</p> <p><strong>Location Type :</strong></p> <p>Health facilities</p> <p><strong>Description</strong> <strong>:</strong></p> <p>Saint Camille Medical Centre &amp; &nbsp;Biomolecular Research Centre Pietro Annigoni, Ouagadougou, Burkina Faso.</p> <p><strong>Sample size &nbsp;: &nbsp;</strong><span style=""color: rgb(31, 31, 31)"">&nbsp;</span></p> <p><span style=""color: rgb(31, 31, 31)"">1 300&nbsp;</span></p> <p></p> </div>","","","eppi-reviewer4; Adult; Female; Humans; Pregnancy; Prospective Studies; Prevalence; Infectious Disease Transmission, Vertical/*prevention & control; Socioeconomic Factors; Child; Anti-HIV Agents/*therapeutic use; Polymerase Chain Reaction; Burkina Faso/epidemiology; Antiretroviral Therapy, Highly Active/*methods; HIV Infections/*drug therapy/epidemiology/*prevention & control/transmission","","","","","","","","","","","","","","","","","","","","","","","","","","","","","","","","","","","","","","","","","","","","","","",""
"26ZKLGFV","journalArticle","2016","Abalos E; Addo V; Brocklehurst P; El Sheikh M; Farrell B; Gray S; Hardy P; Juszczak E; Mathews JE; Naz Masood S; Oyarzun E; Oyieke J; Sharma JB; Spark P","Caesarean section surgical techniques: 3 year follow-up of the CORONIS fractional, factorial, unmasked, randomised controlled trial.","Lancet (London, England)","","0140-6736 (LINKING)","10.1016/S0140-6736(16)00204-X","","BACKGROUND: The CORONIS trial reported differences in short-term maternal morbidity when comparing five pairs of alternative surgical techniques for caesarean section. Here we report outcomes at 3 years follow-up. METHODS: The CORONIS trial was a pragmatic international 2 x 2 x 2 x 2x 2 non-regular fractional, factorial, unmasked, randomised controlled trial done at 19 sites in Argentina, Chile, Ghana, India, Kenya, Pakistan, and Sudan. Pregnant women were eligible if they were to undergo their first or second caesarean section through a planned transverse abdominal incision. Women were randomly assigned by a secure web-based allocation system to one intervention from each of the three assigned pairs. All investigators, surgeons, and participants were unmasked to treatment allocation. In this follow-up study, we compared outcomes at 3 years following blunt versus sharp abdominal entry, exteriorisation of the uterus for repair versus intra-abdominal repair, single versus double layer closure of the uterus, closure versus non-closure of the peritoneum, and chromic catgut versus polyglactin-910 for uterine repair. Outcomes included pelvic pain; deep dyspareunia; hysterectomy and outcomes of subsequent pregnancies. Outcomes were assessed masked to the original trial allocation. This trial is registered with the Current Controlled Trials registry, number ISRCTN31089967. FINDINGS: Between Sept 1, 2011, and Sept 30, 2014, 13,153 (84%) women were followed-up for a mean duration of 3.8 years (SD 0.86). For blunt versus sharp abdominal entry there was no evidence of a difference in risk of abdominal hernias (adjusted RR 0.66; 95% CI 0.39-1.11). We also recorded no evidence of a difference in risk of death or serious morbidity of the children born at the time of trial entry (0.99, 0.83-1.17). For exteriorisation of the uterus versus intra-abdominal repair there was no evidence of a difference in risk of infertility (0.91, 0.71-1.18) or of ectopic pregnancy (0.50, 0.15-1.66). For single versus double layer closure of the uterus there was no evidence of a difference in maternal death (0.78, 0.46-1.32) or a composite of pregnancy complications (1.20, 0.75-1.90). For closure versus non-closure of the peritoneum there was no evidence of a difference in any outcomes relating to symptoms associated with pelvic adhesions such as infertility (0.80, 0.61-1.06). For chromic catgut versus polyglactin-910 sutures there was no evidence of a difference in the main comparisons for adverse pregnancy outcomes in a subsequent pregnancy, such as uterine rupture (3.05, 0.32-29.29). Overall, severe adverse outcomes were uncommon in these settings. INTERPRETATION: Although our study was not powered to detect modest differences in rare but serious events, there was no evidence to favour one technique over another. Other considerations will probably affect clinical practice, such as the time and cost saving of different approaches. FUNDING: UK Medical Research Council and the Department for International Development.","2016-07","2024-02-20 10:59:35","2024-02-20 10:59:35","","62-72","","10039","388","","","","","","","","","","","","","","","","","Number: 10039 Place: England","<div data-schema-version=""8""><p><strong>Location Information</strong></p> <p><strong>Location Name</strong> <strong>:</strong></p> <p> Komfo anokye teaching hospital , Kenyata National hospital, Omdurman maternity Hospital, Soba University hospital</p> <p><strong>Location type</strong> <strong>:</strong></p> <p>Health facilities</p> <p><strong>Description</strong> <strong>:</strong></p> <p><span style=""color: rgb(80, 80, 80)""><span style=""background-color: rgb(255, 255, 255)"">19 sites in Argentina, Chile, Ghana, India, Kenya, Pakistan, and Sudan</span></span></p> <p><strong>Sample size</strong> <strong>:</strong></p> <p><span style=""color: rgb(80, 80, 80)""><span style=""background-color: rgb(255, 255, 255)"">15 935&nbsp;</span></span></p> <p></p> <p></p> <p></p> </div>","","","eppi-reviewer4; Adult; Female; Humans; Pregnancy; Pregnancy Outcome; Cesarean Section/*methods; Dyspareunia/epidemiology; Pelvic Pain/epidemiology; Postoperative Complications/*epidemiology; *Wound Closure Techniques; Catgut; Dissection/methods; Hysterectomy/statistics & numerical data; Peritoneum/*surgery; Polyglactin 910; Postpartum Hemorrhage/*epidemiology; Uterus/*surgery","","","","","","","","","","","","","","","","","","","","","","","","","","","","","","","","","","","","","","","","","","","","","","",""
